{
  "version": 1,
  "name": "cell",
  "status": "desktop-only",
  "role": "cell",
  "summary": "One cell of a row.",
  "props": {},
  "events": {},
  "content": "text",
  "accessibleName": {
    "from": "none"
  },
  "keyboard": [],
  "within": ["table", "tablebody", "tablerow"],
  "example": {
    "text": "1"
  }
}
