{
  "version": 1,
  "name": "pre",
  "status": "web-only",
  "role": "generic",
  "summary": "Preformatted text.",
  "props": {
    "class": {
      "type": {
        "kind": "string"
      },
      "required": true,
      "webOnly": true
    },
    "tabindex": {
      "type": {
        "kind": "string"
      },
      "required": true,
      "webOnly": true
    }
  },
  "events": {},
  "content": "text",
  "accessibleName": {
    "from": "none"
  },
  "keyboard": [],
  "example": {
    "props": {
      "class": "x",
      "tabindex": "0"
    },
    "text": "a  b"
  }
}
