{
  "version": 1,
  "name": "main",
  "status": "web-only",
  "role": "generic",
  "summary": "The main content of the page (a main landmark).",
  "props": {
    "id": {
      "type": {
        "kind": "string"
      },
      "required": true,
      "webOnly": true
    },
    "tabindex": {
      "type": {
        "kind": "string"
      },
      "required": true,
      "webOnly": true
    }
  },
  "events": {},
  "content": "any",
  "accessibleName": {
    "from": "none"
  },
  "keyboard": [],
  "example": {
    "props": {
      "id": "main",
      "tabindex": "-1"
    },
    "text": "x"
  },
  "webRole": "main"
}
