{
  "version": 1,
  "name": "status",
  "status": "portable",
  "role": "status",
  "summary": "A live region: the text inside is a message about what just happened. Polite and atomic. It exists before its text does, so a message put into it is announced.",
  "props": {},
  "events": {},
  "content": "text",
  "accessibleName": {
    "from": "none"
  },
  "keyboard": [],
  "live": {
    "politeness": "polite",
    "atomic": true
  },
  "example": {
    "text": "Saved."
  }
}
