{
  "version": 1,
  "name": "aside",
  "status": "web-only",
  "role": "generic",
  "summary": "Content aside from the content around it (a complementary landmark).",
  "props": {
    "class": {
      "type": {
        "kind": "string"
      },
      "required": true,
      "webOnly": true
    }
  },
  "events": {},
  "content": "any",
  "accessibleName": {
    "from": "none"
  },
  "keyboard": [],
  "example": {
    "props": {
      "class": "x"
    },
    "text": "x"
  },
  "webRole": "complementary"
}
