{
  "version": 1,
  "name": "radiogroup",
  "status": "portable",
  "role": "radiogroup",
  "summary": "A group of radios: choose one of a few. It has no events; its radios raise them.",
  "props": {
    "label": {
      "type": {
        "kind": "string"
      },
      "required": false,
      "a11y": "name"
    },
    "invalid": {
      "type": {
        "kind": "boolean"
      },
      "required": false,
      "a11y": "state"
    },
    "describedby": {
      "type": {
        "kind": "string"
      },
      "required": false,
      "a11y": "relationship"
    }
  },
  "events": {},
  "content": {
    "only": [
      "radio",
      "label"
    ]
  },
  "accessibleName": {
    "from": "prop",
    "prop": "label",
    "required": true
  },
  "keyboard": [],
  "states": {
    "invalid": "invalid"
  },
  "relations": {
    "describedby": "ref"
  },
  "example": {
    "props": {
      "label": "Size",
      "describedby": "hint"
    },
    "children": [
      {
        "name": "radio",
        "props": {
          "checked": true,
          "value": "s",
          "label": "Small"
        }
      }
    ],
    "describedByText": "Pick one"
  }
}
